commit	val_cer	word_acc	memory_gb	status	description
3ebd8da	0.872440	0.000000	3.4	keep	baseline crnn+ctc
3411aaf	0.793942	0.030568	3.4	keep	smaller batch and higher lr
4170c80	0.782850	0.037118	3.4	keep	smaller total batch
89316dc	0.784983	0.026201	3.4	discard	higher lr at small batch
a4bfa5a	0.769625	0.037118	3.4	keep	total batch 32
1c010c6	0.792662	0.034934	3.4	discard	per-device batch 16
6552c67	0.779437	0.041485	3.4	discard	remove dropout
bd90ff4	0.786689	0.039301	3.4	discard	smaller lstm hidden
a84f80a	0.754693	0.045852	3.4	keep	remove warmup
42cc42d	0.785836	0.039301	3.4	discard	zero final lr
b379ced	0.765785	0.052402	3.4	discard	enable amp
38b5a7b	0.790956	0.041485	3.4	discard	higher final lr floor
74d31dd	0.770904	0.024017	3.4	discard	total batch 16
23959b9	0.761519	0.034934	3.4	discard	total batch 24
3de4fdb	0.765358	0.056769	3.4	discard	mild weight decay
41bad42	0.774744	0.050218	3.4	discard	lighter weight decay
7ed342e	0.762799	0.045852	3.4	discard	lower lr
1884e34	0.764078	0.045852	3.4	discard	higher lr
d00bb29	0.779437	0.039301	3.4	discard	lighter dropout
a6d2344	0.783703	0.039301	3.4	discard	stronger dropout
e930dc0	0.781143	0.037118	3.4	discard	shorter beta2
1dfba6b	0.772184	0.030568	3.4	discard	GRU head instead of LSTM
7192ce2	0.732509	0.069869	3.4	keep	sequence LayerNorm before classifier
6435adc	0.773891	0.054585	3.4	discard	residual temporal refine after LayerNorm
818e0ed	0.765358	0.074236	3.4	discard	residual MLP head after LayerNorm
cbf0971	0.713737	0.087336	3.4	keep	add SE channel attention to Aster blocks
ee25656	0.766212	0.067686	3.4	discard	SiLU activations in encoder
ae45646	0.691126	0.120087	3.4	keep	pre-RNN LayerNorm on encoder sequence
d91dab7	0.824232	0.024017	3.4	discard	late-stage SE only
fe69bc3	0.675341	0.104803	3.4	keep	GroupNorm encoder blocks
6f969d8	0.812713	0.030568	3.4	discard	remove post-LSTM LayerNorm
ef646c4	0.704352	0.098253	3.4	discard	remove pre-RNN LayerNorm
2a7885b	0.718003	0.072052	3.4	discard	RMSNorm head after LSTM
14a5413	0.763652	0.063319	3.4	discard	RMSNorm before LSTM
de87f00	0.773464	0.048035	3.4	discard	wider recurrent head
22ad3e9	0.794369	0.050218	3.4	discard	narrower recurrent head
29acbe3	0.773464	0.054585	3.4	discard	add SE gate to stem
088183d	0.755546	0.078603	3.4	discard	deeper two-conv stem
a43c457	0.703925	0.087336	3.4	discard	fuse layer4 features into layer5
9050c23	0.682167	0.113537	3.4	discard	pre-RNN projection bottleneck
a3f35e9	0.692833	0.080786	3.4	discard	residual pre-RNN adapter
bfd58c2	0.825085	0.067686	3.4	discard	zero-init residual branch norms
924a75b	0.663396	0.124454	3.4	keep	lower lr on conditioned backbone
ee39e2e	0.648464	0.135371	3.4	keep	lower lr bracket
fd7ffef	0.673208	0.131004	3.4	discard	lower lr further
02522af	0.677901	0.133188	3.4	discard	lower final lr floor
9fb53d1	0.665956	0.120087	3.4	discard	higher final lr floor
4a7ad3c	0.747440	0.091703	3.4	discard	small warmup on conditioned backbone
d94fa70	0.646758	0.137555	3.4	keep	higher beta2 on conditioned backbone
fe3e291	0.652730	0.144105	3.4	discard	even higher beta2
4b623ba	0.656143	0.109170	3.5	discard	EMA on conditioned backbone
db9b06d	0.666809	0.117904	3.4	discard	tiny weight decay on conditioned backbone
51c91ba	0.669369	0.124454	3.4	discard	higher beta1 on conditioned backbone
34fa0bd	0.641638	0.126638	3.4	keep	lower beta1 on conditioned backbone
066f31e	0.651451	0.152838	3.4	discard	lower beta1 bracket
2bfc6e3	0.673635	0.128821	3.4	discard	tighter grad clip on conditioned backbone
a9ee9eb	0.750853	0.100437	3.4	discard	larger batch on conditioned backbone
252a617	0.661263	0.122271	3.4	discard	smaller batch on conditioned backbone
76f9bbb	0.634812	0.144105	3.4	keep	higher beta2 with lower beta1
5f1c9ca	0.622014	0.159389	3.4	keep	beta2 bracket above new best
bd7ee6c	0.635239	0.137555	3.4	discard	upper beta2 edge on new optimizer
c9e02f4	0.647611	0.161572	3.4	discard	midpoint beta2 refinement
4f56ca9	0.770904	0.067686	3.4	discard	retune lr on beta2 peak
139bf83	0.709471	0.113537	3.4	discard	add pre-RNN local mixer
96a597f	0.689420	0.117904	3.4	discard	add pre-RNN positional bias
73483ab	0.793515	0.054585	3.4	discard	enable amp on optimizer peak
c2aec4b	0.750000	0.076419	3.4	discard	enable bf16 amp
e3ebdda	0.692406	0.120087	3.4	discard	remove dropout on optimizer peak
7792353	0.632253	0.146288	3.4	discard	negative blank bias for CTC
7938f4e	0.655290	0.148472	3.4	discard	milder negative blank bias
dbe505d	0.650171	0.137555	3.4	discard	higher lr floor with slow beta2
e431149	0.715017	0.043668	2.6	discard	preserve width at layer2
95cfc68	0.814420	0.032751	2.6	discard	preserve width with smaller recurrent head
f934290	0.692833	0.122271	3.4	discard	shallower recurrent stack
ca7fcdf	0.643345	0.122271	3.4	discard	wider one-layer LSTM
10b4225	0.619027	0.159389	3.4	keep	even wider one-layer LSTM
b8968bd	0.632253	0.157205	3.4	discard	lower bracket for one-layer width
f8966d3	0.645904	0.139738	3.4	discard	upper bracket for one-layer width
d44d8c7	0.632253	0.150655	3.4	discard	retune beta2 on new one-layer best
7d32529	0.669795	0.128821	3.4	discard	add RNN skip fusion
a26b47a	0.818259	0.061135	3.4	discard	project into one-layer LSTM
3a5bd54	0.656143	0.148472	3.4	discard	projected wide one-layer LSTM
22e9a8e	0.776451	0.098253	3.4	discard	add auxiliary CTC supervision
d720459	0.686860	0.131004	3.4	discard	revisit wider two-layer LSTM
502dfb3	0.736775	0.117904	3.4	discard	lighten final encoder stage
c6ab25c	0.618601	0.146288	3.4	keep	stronger dropout on one-layer best
4e81844	0.599829	0.176856	3.4	keep	upper dropout bracket on one-layer best
763771d	0.599403	0.155022	3.4	keep	higher dropout after big gain
6b91f9a	0.627133	0.150655	3.4	discard	upper edge of new dropout regime
abf2518	0.633959	0.141921	3.4	discard	midpoint refinement in new dropout peak
f36e094	0.640785	0.124454	3.4	discard	reproducibility check for new best
cb1e715	0.618174	0.155022	3.4	discard	reproducibility check for dropout 0.2
60c00b0	0.668515	0.115721	3.4	discard	stabilize high dropout with lower lr
a802e69	0.601536	0.163755	3.4	discard	stabilize high dropout with slower beta2
dbeb4af	0.638652	0.155022	3.4	discard	combine stable dropout with slower beta2
aebe7d7	0.702218	0.117904	3.4	discard	locked dropout on one-layer best
00fdead	0.665102	0.133188	3.4	discard	light width masking on stable one-layer head
3741cea	0.643345	0.144105	3.4	discard	multi-sample dropout on high-dropout head
428475d	0.665102	0.120087	3.4	discard	cosine classifier on stable one-layer head
f332adb	0.685580	0.120087	3.4	discard	weight-normalized classifier on stable one-layer head
8b34c89	0.666382	0.128821	3.4	discard	residual head gate on stable one-layer head
640c697	0.650597	0.122271	3.4	discard	negative blank bias on stable one-layer head
fa03235	0.694539	0.122271	3.5	discard	deepen late encoder on stable one-layer head
f747e97	0.640785	0.128821	3.4	discard	two-layer recurrent compromise on stable head
477ba67	0.652304	0.133188	3.4	discard	post-RNN temporal refine on stable one-layer head
594cc09	0.792235	0.054585	3.4	discard	cheaper two-layer recurrent compromise
c90e277	0.632679	0.141921	3.4	discard	linearly ramp dropout to high regime
73caf8c	0.559727	0.211790	3.4	keep	late high-dropout from stable start
c83829e	0.620734	0.131004	3.4	discard	reproducibility check for dropout schedule best
025cf28	0.634386	0.146288	3.4	discard	combine dropout schedule with early blank offset
0d57c0a	0.625853	0.141921	3.4	discard	extend best dropout schedule to 10-minute budget
411eec7	0.589590	0.152838	3.4	discard	strengthen late dropout on 10-minute schedule
c304a8a	0.618174	0.155022	3.4	discard	backload best dropout schedule
4f9d6b9	0.625000	0.150655	3.4	discard	stabilize dropout schedule with slower beta2
7a1e186	0.642065	0.117904	3.4	discard	widen scheduled dropout endpoint
5b52302	0.641638	0.144105	3.4	discard	delayed ramp for dropout schedule
